<?xml version="1.0" encoding="utf-8" ?>
<!DOCTYPE FiniteAutomaton SYSTEM "../Input.dtd">
<FiniteAutomaton>
  <InputAlphabet>
    <Symbol>0</Symbol>
    <Symbol>1</Symbol>
  </InputAlphabet>
  <States>
    <State x="150" y="100" start="Y" accept="Y">q0</State>
    <State x="400" y="100" start="Y">q1</State>
    
    <State x="50" y="217" accept="Y">q2</State>
    <State x="500" y="217">q3</State>
    
    <State x="150" y="334">q4</State>
    <State x="400" y="334">q5</State>
  </States>
  <Transitions>
    <Transition from="q0" symbol="0" to="q2" />
    <Transition from="q0" symbol="1" to="q1" />
    <Transition from="q1" symbol="0" to="q3" />
    <Transition from="q1" symbol="1" to="q0" />
    <Transition from="q2" symbol="0" to="q0" />
    <Transition from="q2" symbol="1" to="q3" />
    <Transition from="q3" symbol="0" to="q1" />
    <Transition from="q3" symbol="1" to="q2" />
  </Transitions>
</FiniteAutomaton>
